Date,Title,Link,Codes,Content
2026-02-21,解除禁言了......｜聊聊三件事！,http://mp.weixin.qq.com/s?__biz=Mzk0NDAxODE3NQ==&mid=2247504301&idx=1&sn=b2c2822cc27d576e254c284d99bb1c37&chksm=c329963df45e1f2b4dd082835c6ff0986c0bbca6d7d20e5df8f7e1bcdd4d640561c0abb4d586#rd,,"点击蓝字
关注我们
春节前2月8日周日的时候发了一篇文章，可能因为文章中的措辞有点激烈了，导致周一被下架删文并禁言一周.......
这一周还刚好赶上春节假期前最后一周的关键时间节点，着实让人上火。真不是我在关键时刻突然消失，我也相当想说，但是被关小黑屋也没办法。
禁言期间也有坚持在小号“火哥养基”更新了，但是肯定很多朋友没有关注过小号，阅读量只是大号的五分之一不到。
感兴趣的朋友可以先关注上，我基本上每个交易日都会更新，只是偶尔实在忙不过来了会断更一天，但是也很少出现连续多日断更的情况，
如果大家发现我连续两三天都没更新文章的话，极大概率就是禁言了，可以去我的小号“火哥养基”看看，一般禁言期间都会在小号上更新。
书归正传，今天写这篇文章主要是三件事：
一是告知大家大号解封了，春节假期后恢复正常更新节奏；
二是同步一下我个人的持仓现状以及春节期间外围市场的行情表现，分析对A股的影响；
三是讲一个昨晚发生的关于特朗普关税问题的大事件。
春节前最后两周的时间，我个人分批加仓很多的科技，并且几乎约等于持基过节了，目前大约是9成仓位，且科技相关板块仓位占比很重。
科技板块我主要持有四大方向，每个方向大约15%的仓位，分别是：
博春晚行情的机器人、AI应用相关的计算机、硬件方向的半导体和科创50、以及人工智能。
这四个方向每个占总资金的15%仓位，科技方向合计占比约60%仓位。
春节前这一周多的时间，市场整体表现在我看来非常一般，并没有走出理想化的春节行情，但是对于科技而言，我个人认为是走出了一个小春节行情的，春节前这一周科技普遍表现还是不错的，无论是计算机、机器人还是人工智能、半导体，都走出了一个明显的止跌企稳反弹的趋势。
春节期间，从春晚来看，押注科技也是一个比较合理的选择，今年春晚科技的含量空前的高，机器人都出现了四个节目，足以体现了对机器人发展前景的重视，另外还有AI应用也在春晚中占据了非常多的元素，对于AI和机器人相关的产业链都是比较大的利好。
另外，假期期间外围市场整体表现算是不好不坏，美股纳斯达克截止到本周五，假期期间止跌企稳并小幅反弹，反弹幅度也不算大，美股这几个月一直都是不温不火的。
港股方面，春节假期期间目前开盘一天半，16日的时候就开局大跌，后面深V拉回来了，港股创新药和恒生科技最终均小涨收盘。
20日周五港股恢复交易，创新药表现倒是还好，小幅收涨0.53%，但是恒生科技却延续之前的颓势大跌3个点收盘。
从企业的发展前景来看，市场对于方向的选择确实也没有什么问题，2月13日晚上美团发布了2025 年全年业绩预告，
预计 2025 年全年净亏损约 233 亿元至 243 亿元。结合已公布的前三季度数据推算：Q4得净亏损150亿上下。外卖补贴大战确实对这些互联网企业消耗很大，市场一边面临的是有前景的AI应用、机器人等方向，一边面对的是天天烧钱补贴看不到尽头的互联网，资金选择用脚投票也正常。
港股现在的处境确实很是尴尬，夹在A股和美股中间，有点不伦不类，A股跌也得跟跌，美股跌也得跟跌，只有美股和A股一起涨的时候，才能涨一涨，处境确实很尴尬。
不过虽然假期期间港股恒生科技跌幅虽然很大，周五跌了3个来点，但是大家也暂时不用太过于担心，周五晚上美国传出一个利好消息，美国最高法院裁定特朗普政府大规模关税政策违法，白宫也确认了部分关税终止，虽然特朗普一方也已经开始搞了一些替代方案，例如紧急签署了行政令对全球商品加征10%的关税，但是这样一来特朗普一方可操作可回转的余地肯定是没有之前那么高，并且这个关税只为期150天。
这对于全球市场来说算是一个小利好，周五晚上美股纳斯达克小幅拉升，最终收涨0.9%，从涨幅来看不算特别大的利好，市场也知道关税不会就此彻底取消，特朗普肯定也会寻求其他的替代方案，但是肯定也算得上一个小利好。
因此周五夜盘，无论是A50股指期货还是恒生科技股指期货都迎来大幅拉升，A50收涨1个点，恒生科技股指期货拉升2.36%，回补掉了恒生科技周五大部分的跌幅。
如果不出太大意外的话，周一恒生科技开盘应该能回补一些周五的跌幅，但是大的趋势，恒生科技恐怕依旧很难受到资金的持续青睐，前景确实也没有A股的这些科技板块更加乐观。
下周一是春节假期的最后一天，A股依旧休市，美股和港股恢复正常开盘，周一我也将恢复正常更新。
目前来看，我个人持仓结构中，A股科技4个方向占比最高，合计达到了60%左右，是我目前最看好，也比较有信心的方向。
另外，春节前还分批加了一些黄金，黄金的仓位被我从5%提高到了10%，黄金在春节假期期间经历了先跌后涨，纽约金春节前最后一天大约在5060美元/盎司的位置，2月17日大跌，最多时跌破4900点，随后三天连续反弹，周五收盘纽约金已经反弹回到5130点，高于春节前的5060点。
黄金我们属于在前一波大跌后抄底买入了，且近期黄金有逐渐企稳的意思，黄金仓位控制在10%左右，我也一点都不担心。
持仓中最后还有10%的港股创新药和10%的恒生科技，这两个才是比较让我头疼的，下周二恢复交易后，我可能会酌情考虑考虑如何处理这两个板块。目前创新药相对来说还能好一些，趋势还算可以，倒是也不用太担心。
但是恒生科技跌破年线后，接近半个月的时间也没能快速收回到年线上方，已经彻底破坏了震荡上行结构，恒生科技的趋势确实让人更加担心。
下周一我将恢复正常更新节奏，节后再酌情调整持仓结构吧，目前9成仓位，节后需要重点关注科技板块的表现，如果科技板块能够一举突破压力位，彻底形成上涨趋势，我大概率还会进一步加仓，并且调整持仓结构，如果有调整我会发文说。
文章的最后，需要再做一个免责声明：上面所有的分析内容也只是我的个人推测，不代表事实一定如此，也不见得一定对，仅供参考，不构成投资建议，投资有风险，入市需谨慎。
点个“在看”支持一下呗～"
2026-02-05,继续回调，还没跌到位！,http://mp.weixin.qq.com/s?__biz=Mzk0NDAxODE3NQ==&mid=2247504269&idx=1&sn=ab6f767ac816e0b9f00da89ee50d4cf7&chksm=c329961df45e1f0b283a15478d5fe6a0de36836d7eb3392fa8593006725c68ccffbedc532a78#rd,,"点击蓝字
关注我们
今天A股依旧处于护盘阶段，除了银行大涨以外，其他多数板块都迎来不同程度的下跌，尤其是科技板块今天依旧还是1～2个点的跌幅。
今天观察来看，部分科技板块已经开始进入了加速下跌阶段，距离阶段性见底应该是越来越近了。
但是，个人认为还没完全跌到位，要想彻底见底还得再等一等，因此我倾向于建议大家加仓节奏要把控好，加仓不要太频繁太密集，而是拉开幅度的分批买入为好。
我们看一下几个重点关注板块当下的形态：
回调比较早的计算机板块，今天继续下跌1.21%，今天跌的不算多，当下点位8249.17点，距离60日均线仅有一步之遥了，距离最高点的9322.86点，回调幅度约11.5%，这个位置吧确实已经具备了一定的性价比，但是距离距离铁底的位置恐怕还得再耐心等等。
另外，半导体板块也是类似的情况，距离最高点回调幅度大约11个点，距离60日均线仅一步之遥了。
人工智能这两天回调的幅度相对大一些，显然进入了加速砸盘模式，距离阶段性最高点回调幅度差不多也是接近11个点，也是接近60日均线，形态上都十分相似。
当然，机器人也是类似的情况，回调幅度稍微落后一些，但是也差距不大。
科技的这几个细分方向，基本上都已经逼近60日均线，由于元旦前后这一波行情的周期相对比较短暂，上涨幅度相对也没有那么大和持久，回调的幅度和周期很大概率没有前面十一那一波的深，调整时间可能也没那么长。
我个人预估，60日均线附近，逐渐止跌企稳的概率比较大，当然有可能会小幅跌破60日均线，但是跌破的幅度不会很大。
我个人是比较希望明天周五，市场能再跌一波，并能够回调到60日均线附近。如果能如此，我倾向于距离阶段性见底应该就很快了。
科技方向普遍距离回调到60日均线都不是很远了，但是商用航天和卫星差距依旧还是蛮大的，所以这个方向我甚至都还没有开始建底仓，还有不小的距离。
毕竟商用航天和卫星，上一轮的炒作力度比较大，上涨幅度比较大，一旦回调起来，深度也相对会更大，周期相对也会更长一些。虽然卫星距离阶段性最高点已经回调20来个点，但是目前距离60日均线还有不小的距离，卫星和商用航天我倾向于再等一等，还在观察评估中。
黄金有色，我这两天都在反复强调，目前处于一个消化阶段，我们周一大跌那天买入了5%的仓位，后面两天就涨了10个点，但是我也一直反复强调我不认为黄金就已经彻底稳了，今天黄金又跌回来3个多点，盘中最多跌幅接近5个点了。
我是认为，黄金现在每日振幅如此巨大，就不是一个正常的状态，黄金大多数时间还是比较稳定的一个品种，只在阶段性冲高后见顶开始跌的那个阶段振幅会非常巨大，得等到振幅回归到正常水平，才能代表黄金短期投机属性消化完成，开始回归投资属性了，什么时候连续多日单日涨跌幅恢复到1%上下的水平了，黄金就回复正常了，当下如此巨大的振幅，让大家持有太高的仓位，我相信大多数人也受不了，5%仓位先拿一拿在车上就挺好，等恢复稳定后再去进一步加仓，我想是相对比较稳妥的方式。
至于有色，最近随着黄金白银等普遍的回调，有色也迎来了连续下跌，距离阶段性最高点，回调幅度也接近20%了，但是当下这个位置我也依旧认为还有一定的下跌空间，有色近期的涨跌幅非常巨大，这个时候去着急接飞刀恐怕不是很好，最好还是等有色开始逐渐恢复稳定了以后，再去加仓买入会好一些，稍微再等等吧。
传媒游戏我也是还在等，还不到我期待的买点，让子弹再飞一会。
总而言之吧，我个人是认为，当下众多板块均处于一个非常尴尬的阶段，就是确实短期也跌了很多了，有些板块短期甚至还有点超跌了，也具备了一定的性价比，也确实距离阶段性顶部位置回调幅度都不小了。
但是说这个位置就到底了也为时尚早，向下也普遍依旧还有一定的空间，起码60日均线都还没回踩到，我个人是认为怎么着也得回踩到60日均线再进行下一步的加仓操作，部分科技板块，也确实快了，再耐心等一等吧。
只是随着时间一点一点的过去，距离春节假期也只剩下最后6个交易日了，春节前的第二波行情也变得希望越来越小了。
说白了就是前面见顶的周期有点墨迹了，相比我预想的要晚了一周，这周是回调幅度比较大的一周，如果1月最后那一周不墨迹像这周这种表现，时间就比较充足了。
当下距离春节假期越来越近，大家也不能心急了，还是尊重行情走势，也不能认为一定会有春节前的第二波行情，还是看行情到底走到了什么样的一个阶段了，再酌情去做合适的操作吧，按照这个调整节奏，也有可能正式的反弹要等到春节之后了。
先边走边看吧，先看看明天市场能不能再踩一脚，如果明天市场再踩一脚，回调到60日均线附近，我会考虑再加一些，那么春节前就还有希望有一个小行情。
但是，
如果明天市场迎来超跌反弹，没有继续砸盘下跌，砸出空间来，那么恐怕就得从长计议了，调整周期可能会进一步拉长了，春节前不见得能调整到位并迎来新一轮行情了。
咱们边走边看吧，有什么最新的观点，我尽快更细分享，供大家参考。
最后，宣传一下我的VIP会员群，每个交易日都有午评分析，操作实时分享，以及VIP专属定制化持仓优化服务，还有基本面、技术面、消息面知识分享教学，有想加入VIP群的朋友，可以后台发送VIP了解一下。
文章的最后，需要再做一个免责声明：上面所有的分析内容也只是我的个人推测，不代表事实一定如此，也不见得一定对，仅供参考，不构成投资建议，投资有风险，入市需谨慎。
点个“在看”支持一下呗～"
2026-02-04,科技大跌！调仓并小加一些！,http://mp.weixin.qq.com/s?__biz=Mzk0NDAxODE3NQ==&mid=2247504253&idx=1&sn=8f4f07648e1e06b04bb5741285eb1ec4&chksm=c32996edf45e1ffb536f3a37ec7d55bd0ab7e1b0765f69a899af3ba9f5e821742e5f2361d0e3#rd,,"点击蓝字
关注我们
今天A股的行情表现两极分化特别显著，科技等成长板块普遍跌的比较惨，而且跌幅巨大，但是价值风格尤其是煤炭大涨护盘，导致大盘今天不仅没跌，甚至还涨的不错。
最近A股的行情就走的非常经典，根据以往的经验，我之前的文章视频里，给大家总结过A股通常一轮行情会经历几个不同的阶段。
阶段一：主升浪行情，这个阶段通常都是科技等主线方向方向持续发力，带动大盘持续上涨，防御板块、价值风格板块此时通常表现一般，这个阶段A股的赚钱效应拉满。
阶段二：筑顶阶段，成长风格普遍涨多了，位置有点高了，板块开始出现分化，频繁轮动但通常都没有持续性。大盘则明显涨不动了，但是也跌不下去。此时通常伴随着市场热度及量能达到极致，方便大资金出货。
阶段三：护盘阶段，到了这个阶段，通常成长风格都开始陆续见顶开始回调，顶部已经走的非常明显了，大家基本上都能看得出来了，成长风格普遍开始大幅回调砸盘。但是这个阶段通常大盘不会跌多少，因为此时之前一直没啥表现的价值风格板块会迎来短暂的春天，由于位置本身够低，得到避险资金的青睐，开始持续流入并快速拉升，价值大涨成长大跌互相对冲，大盘小涨小跌，此为护盘阶段。
阶段四：砸盘阶段，等到价值风格短期也拉升不少了，同时成长风格也持续跌了不少了，通常紧接着还会有一个加速砸盘阶段，成长风格继续回调，短期涨多了的价值风格也开始转跌，没有护盘的板块了，大盘大跌并回调到阶段性较低位置。
阶段五：筑底阶段，成长风格充分回调到较低位置，跌势放缓，开始进入震荡筑底阶段，主力吸筹，为下一波主升浪阶段做准备。
我们A股的行情，基本上就是反反复复在经历上面几个阶段轮回，拿近两轮行情举例：
去年十一前七八月份那阵明显属于阶段一主升浪行情；
十一前后进入到阶段二筑顶行情，都涨不动了，但是也显然跌不来；
随后11月份上前半个多月进入护盘阶段，红利、银行、煤炭、电力等板块普遍迎来拉升，而11月份成长风格见顶普遍都比较明显了，而且还在继续跌，但是也显然没跌到位；
然后11月下旬的时候，就开始进入砸盘阶段了，成长风格继续跌，价值风格也突然调转方向也开始砸盘，而且砸得还挺暴力，导致当时大盘出现了连续大幅下跌。
到了12月上半月成长风格逐渐跌到位，普遍开始震荡筑底，尤其是计算机、机器人等都跌到年线止跌了，半导体、人工智能等虽然没有回调到年线，但是也在60日均线附近跌不动了，进入筑底阶段了。
我们上一轮正是在这个筑底阶段开始陆续进场分批加仓并满仓的嘛，跟着投的朋友应该都有印象。
前一个轮回结束，那么近期这个轮回我们再一起看看：
12月下半个月加上1月上半个月，开启了一小段主升浪行情；
随后由于某资金力量的持续打压，强行降温，导致1月下半个月开始进入筑顶阶段，4100点附近始终也涨不上去了，但是也跌不下来；
那么我个人认为这两天市场开始进入到护盘阶段了，最直观的两个特征就是，现在是个人都能看出来成长风格板块已经见顶了，并且已经回调到了半山腰以下位置。
并且，之前一直死不死活不活的红利、银行、煤炭、电力等板块开始拉升护盘，帮大盘对冲掉了成长风格大跌的影响。
这个阶段通常是我认为最具有迷惑性，也最不好做的阶段，一看科技等成长板块都跌傻了，市场亏钱效应拉满了，但是
一看大盘没怎么跌，甚至可能还涨的。
很多人此时可能意识到了，成长风格已经见顶，价值风格是不是要起来了，转过身去投价值风格了，结果价值风格护盘也没啥持续性，估计没多久就调转方向跟着砸盘，市场开始泥沙俱下了。
很多人容易成长风格被割一遍，跑到价值风格以为防御防御能挺稳，结果又被割一遍，我已经两次在这个阶段栽跟头了.......
当然，我相信市场一定是有周期性的，每一轮行情的几个阶段多少会有一些规律存在，我只是经历得多了，根据自己的经验总结了一下，分享给大家，大家对行情处于哪个阶段大体能有个心理预期，仅作为经验分享供大家参考，不代表一定对哈，不作为投资指导意见。
分享完，简单说一说我今天的操作吧，我今天主要是对持仓的结构做了一个调整，并顺道小加了一点仓位。
今天总算是出现了一次科技板块普遍大跌，跌幅巨大，且港股跌的比较少的情况了，最近也给了港股很多天的机会了，但是如此羸弱的行情，确实让人十分无奈，如果只是中性仓位或者轻仓参与到是也无妨，但是我个人场内账户港股的仓位占比还挺高的，场外仓位相对能低一些。
且不论港股恒生科技已经彻底跌破年线，破位了这个我认为的牛熊分界线，那么出于避险情绪考量，也起码不应该重仓了，并且我也给了他三天的机会，结果三天不仅没有收回到年线上方，反而是进一步下探。
出于纪律性的考量，我个人会认为起码不应该重仓去冒险，因为向下没有强支撑了，也不知道什么时候能彻底见底并反弹，心里没底。
因此我今天把场内外账户持仓的恒生科技和创新药都先降低回到了10%的中性仓位，场外账户原本持有港股的仓位就没那么高，只是合计降低并腾出来8%的子弹，而场内则相当于减仓了一半，合计腾出20%的子弹。
因为今天盘中科技板块跌幅特别巨大，尤其是人工智能，今天跌幅达到5个多点，因此今天下午开盘的时候，我就带着vip群的粉丝顺势加仓了一些科技板块的ETF。
其中人工智能加仓幅度最大，因为之前认为人工智能跌得太少了，一直没加仓，这几天跌得多一些，并且今天大跌5个多点，就选择一下加仓了10%的仓位。
另外，计算机和半导体今天盘中跌幅也不小，都跌了3个点以上，虽然2点以后拉回来不少，但是我在下午开盘后场内就进行了操作，基本上买在了日内最低点，这两个我都加了5%的仓位，将仓位都提高到了10%仓位。
最后，机器人我今天其实非常纠结要不要加，因为今天机器人跌的不多，盘中最多的时候也就跌了1.8个点，并且近期机器人的回调有一点停滞，这个时候加仓性价比差点意思。
但是下午开盘的时候，我最终还是决定小加了一些机器人，跌1.8个点的时候，场内加仓了5%的仓位，机器人的仓位也提高到了10%仓位。
总的算下来，我今天其实加仓幅度不算大，主要是调整持仓结构为主，适当减仓港股，并加仓A股科技，总仓位大概也就提高了5%。
本周场内外账户总仓位分批加到了65%，A股科技的几个细分方向，仓位合计达到40%，港股互联网和创新药两个方向仓位合计退回到20%，另外，还有周一抄底买入的5%仓位黄金。
黄金最近也是离谱，周一抄底买入一些，两天盈利10个点了，最近黄金也是暴涨暴跌的，这个位置我暂时也不打算加了，我是认为黄金还需要反复涨跌震荡磨一磨，没那么容易刚狂跌完没两天，立马又开始一路起飞不回头了。
我想黄金下一次加仓我起码要等到两个点，一个是振幅缩窄到合理范围，例如单日涨跌波动回归到1%上下；另一个就是量能降下来，投机资金逐步离场，交易量下降回到合理范围。
这两个条件达成后，黄金基本上底也就走稳了，否则就会频繁炒作，一会暴涨一会暴跌的，我还是想投资做一做中线波段，而非赌博短期暴涨暴跌的。
另外，除了科技、黄金和港股，我也在重点关注一些其他方向，例如商用航天/卫星、光伏/新能车、化工、有色、传媒 / 游戏等，都还没有跌到我心里想出手的位置，没有达到我心中的买点，我还在观察。
最后的最后，美股最近像是中了某种魔咒一样，始终还是在横盘震荡，只要涨到区间上沿部分就要开始下跌回调，跌倒区间下沿附近，就又会反弹，最近美股行情无聊到了极点。
我这两天美股没什么大动作了，就先保持当下持仓拿着呢，美股纳斯达克当下这也没啥方向，就没必要乱动了，先重点关注吧。
最后，宣传一下我的VIP会员群，每个交易日都有午评分析，操作实时分享，以及VIP专属定制化持仓优化服务，还有基本面、技术面、消息面知识分享教学，有想加入VIP群的朋友，可以后台发送VIP了解一下。
文章的最后，需要再做一个免责声明：上面所有的分析内容也只是我的个人推测，不代表事实一定如此，也不见得一定对，仅供参考，不构成投资建议，投资有风险，入市需谨慎。
点个“在看”支持一下呗～"
