Date,Title,Link,Codes,Content
2026-05-08,开始分批止盈机器人！下一个主线板块是？,http://mp.weixin.qq.com/s?__biz=Mzk0NDAxODE3NQ==&mid=2247504979&idx=1&sn=b6e0ef92cadb1b918b9bbe1c68024d45&chksm=c32993c3f45e1ad53f253fbf3d498397ef5aa41b86b578894528e9d0ace8e0b978f32fb2b666#rd,,"点击蓝字
关注我们
从前几天我就一直反复给出一个观点，短期先看科技板块内部轮动，后续再看其他风格板块接力科技，这是我做这一轮行情的核心思路。
最开始是CPO一骑绝尘，随后是AI板块崛起，五一前后又到了半导体接力，按理来说怎么也该轮到机器人和计算机补涨了。
五一后这三天，明显看出机器人迎来了补涨行情，昨天盘中我更是在激进账户冒险加仓做了一波短线，今天机器人继续大幅上涨，已经逼近前高的位置了，上涨明显已经加速，个人认为机器人板块距离阶段性顶部位置也是越来越近了，从下图大家也是能看的非常明显。
因此，从今天开始机器人在我这里要开始分批减仓止盈了，这个位置必然是只卖不买了，因为机器人我的仓位甚至给到了20%仓位左右，因此我今天先减仓了三分之一，先锁定了部分盈利，剩下的三分之二仓位，下周内酌情分批减仓止盈锁定全部利润。
至于计算机，我还在持有，计算机我的持仓仓位其实也不低，这一波的行情比较特殊，如果持续跟踪关注，你会发现这一波行情下，硬件方向的行情普遍更为强势，但是软件方向始终是不温不火，计算机板块这一波的上涨行情显然也是被半导体等硬件的行情给带起来的，软件的表现反倒是脱了后腿，下面大家可以对比看一下计算机和软件这两个板块的对比。
其实总的来说，我个人是认为硬件方向短期已经涨的过多了，我是认为即便不说最高点也是顶部区间了，后续硬件相关的方向反倒需要更加关注风险，依旧关注好止盈节奏。
但是软件相关的方向反倒尚且处于低位，如果高低切换，软件方向迎来补涨，一定程度也能带动计算机板块上涨，这是我目前依旧还保留计算机没有止盈的原因之一，另一个也是因为计算机目前上涨还差一口气，如果后续突破9300创下新高，我估计我也会开始分批减仓止盈计算机了。
我现在有一个想法和计划，就是等到计算机成功突破前高的时候，基本上也就接近顶部位置了，那个时候很有可能软件板块也刚好对压力位形成突破，我可能会考虑把计算机的仓位转给软件方向，去布局相对低位的软件。当然后续具体如何操作，还得看后续两个板块的走势发展再说，当下只是有这么一个计划而已。
CPO、人工智能、半导体、机器人、计算机这些板块都已经轮流拉升一遍了，都已经明显涨多了，并且随时可能见顶开始持续回调，并且这些板块我也在陆续减仓止盈了，腾出来的仓位加给什么板块更合适呢？哪些板块更有潜力呢？近期的文章视频里面，我其实已经明确表达多次我的个人观点。
首先第一个就是卫星、商用航天、军工，这仨算是一个方向和概念，我昨天文章视频就说了，我的持仓已经布局了10%仓位的卫星和军工，就在等右侧趋势形成了，右侧趋势一旦形成，就是进一步上仓位到重仓的好机会，依我看卫星的右侧趋势已经基本上初步形成了。
我个人认为卫星军工这两个板块右侧趋势初步形成，非常有潜力成为下一个接力的主线板块，因此我打算进一步分批加仓卫星和军工了，最多提高到20%仓位。
另外，电网设备目前趋势也延续的不错，我也会重点去做，但是因为它之前回调的不多，位置依旧比较高，因此我不会给他特别重的仓位，最多可能也就给到15%以下。
另外，有色金属也会成为我下一个重点做的板块，一来黄金逐渐企稳，二来铜等小金属最近势头很猛，稀土最近也形成了突破，有色金属板块中的几个细分方向，近期有希望形成合力，有色金属有很大机会走出右侧趋势来，目前是初期阶段，小幅加仓或者再观察一两天都可以。
有色或者稀土+黄金分开做，我个人认为都可以，看大家自己的选择了，这个方向也是我后续重点做的方向。
至于游戏，我希望等他能够顺利突破压力位以后，再去进一步加仓，游戏见底肯定是见底了，但是什么时候能彻底突破形成右侧趋势迎来爆发，估计还得等一等。
总结而言，我个人的观点和后续做法哈：
1、大家也知道我之前都是大重仓科技的，我之前整个A股持仓中50%左右的仓位都给到了科技，这是我4月份重点做的板块。
2、5月份我个人的主旋律是，逐渐分批止盈掉持仓中比较高位的科技板块，人工智能、半导体已经全部清仓止盈。
机器人今天刚开始分批减仓止盈，预计下周减完清仓；计算机破前高也会考虑开始减仓止盈。
3、卫星、军工、商用航天已经走出右侧趋势，5月份我会重点做这个方向，分批加仓。
4、有色金属、稀土即将形成右侧趋势，后续会酌情分批加仓。
5、软件方向重点关注，游戏方向重点关注，二者均要等到突破压力位后，再开始酌情加仓布局，目前尚且处于低位。
6、电网设备趋势延续不错，保持当下仓位继续持有。
7、大盘暂时继续持有，关注后续4200点能否突破并延续趋势，这一波大盘走的比较稳，只要神秘力量不再突然出来搞事，突然又给市场降温什么的。
大盘稳步上涨，板块高低逐渐切换轮动，这是后续一段时间A股比较理想的涨法。
最后，恒生科技我再重点关注，并小幅埋伏了一些，问恒生科技的人实在是多，这阶段性的底应该是已经形成了，但是恒生科技我个人认为短期也不见得会有什么特别大的行情，可能也只能吃一个小波段，因为今年降息预期还不是很明确，依旧存在诸多不确定性，恒生科技这种港股很看美元指数表现，美元走强恒生科技不好有特别好的表现，得持续走弱恒生科技才有强势拉升的基础，但是目前来看美元指数也没有大幅走弱的基础，毕竟降息预期还有点弱。
恒生科技这一波我极有可能也就是一个底部位置埋伏一些，做一个超跌反弹，年线位置再看看能否突破，突破不了就止盈卖掉，突破了再拿一拿，反正位置足够低了，估计这个位置也亏不到哪里去了。
近期原油下跌，煤炭下跌，化工下跌，这些板块短期可能要规避一下，大家自己关注吧，反正我没投，包括煤炭会影响比较大的红利，近期可能也是回调趋势为主。
最后我想问一下，为什么还有人评论区问我白酒，还在坚持做白酒的人，大家是有什么受虐倾向吗？咱们为什么要放弃科技这种板块不做，哪怕是放着稳健的大盘不做，非要去做这好几年都在阴跌不断的板块呢？真就每天都在梦里幻想着白酒能突然大爆发成为下一轮的主线吗？我奉劝还是放弃幻想吧，别为你的损失厌恶和沉没成本买单了，也别再问我白酒能不能加仓了，问就是避开白酒这种板块，我文章里都说过很多次了。
最后的最后，美股已经减仓到半仓观望，个人认为短期涨太多了，已经锁定了一半的收益。
我认为要么1、回调充分，要么2、恢复小碎步缓慢震荡上行，上涨斜率放缓，我会考虑加回来，否则就先半仓观望了。
最后，宣传一下我的VIP会员群，每个交易日都有午评分析，操作实时分享，以及VIP专属定制化持仓优化服务，还有基本面、技术面、消息面知识分享教学，有想加入VIP群的朋友，可以后台发送VIP了解一下。
文章的最后，需要再做一个免责声明：上面所有的分析内容也只是我的个人推测，不代表事实一定如此，也不见得一定对，仅供参考，不构成投资建议，投资有风险，入市需谨慎。
点个“在看”支持一下呗～"
2026-05-07,机器人补涨！小幅调仓！,http://mp.weixin.qq.com/s?__biz=Mzk0NDAxODE3NQ==&mid=2247504962&idx=1&sn=8d052fc74182b1d0f93973595b096872&chksm=c32993d2f45e1ac4006c899b354b31e8db450e0fb63fdd5d7d444fd0494aec243dca1790f81e#rd,,"点击蓝字
关注我们
今天A股表现继续不错，大盘和沪深300小涨0.48%，我持仓的板块今天有两个迎来爆发，
三个表现也不错，持仓收益继续跑赢大盘一个多点，5月这前两个交易日表现相当不错。
昨天的行情是由硬件主导，半导体、计算机这些板块表现非常强势，今天则切换了方向，回调一段时间的CPO今天迎来大幅反弹。
另外，今天机器人迎来大大幅拉升补涨行情，今天机器人大涨3.82%，科技内部的诸多板块中，也就只有机器人这一波涨幅依旧不算大，昨天我还有提到这一点，今天便迎来了补涨行情。
今天机器人也出现了明显的上涨加速，但是从目前的位置和趋势来看，依旧还有一定的上涨空间，因此我重仓也暂时还没有减仓，而是继续持有，等见顶信号。
计算机今天也小涨1.23%，昨天表现优秀，今天表现中规中矩，向上也依旧还有一定的空间，因此我也没有着急减仓。
机器人和计算机起码打算等到创下新高，出现放巨量滞涨的情况以后再考虑卖出止盈。
另外，今天电网设备迎来了一个小爆发，电网设备这个趋势目前走的我认为还是相当理性的，也并没有出现短期涨多了的情况，刚回踩60日均线支撑后迎来连续两天的反弹，脱离60日均线幅度不大，并没有出现放量超涨的情况，目前来看也并不是很危险。
我个人认为电网设备后续会有一个不错的行情启动，之前我的持仓就持有一部分的电网设备，我今天又进行了小幅的加仓操作，因为看到电网设备已经形成了右侧趋势，果断进一步上了一些仓位。
至于另外两个板块，卫星和有色金属，这两个板块我个人认为他们当下对压力位形成了初步的突破，这肯定是一个好消息，形成右侧趋势并启动大行情的概率越来越高了，但是考虑到目前毕竟刚刚突破压力位，并且右侧趋势也刚刚形成有一点脆弱，另外，我本身也已经持有了不低的仓位，因此我暂时还没有加仓，选择再观望一两天，等右侧趋势更加明显以后，我再去进一步加仓，我估计不远了。
最后，游戏今天表现也难得不错，但是我还是那句话，当下游戏不会成为主要做的方向，可以中性仓位或者轻仓参与，但是先不会重仓，我会等他未来顺利突破上方双重压力位以后，再去酌情提高仓位到重仓，当下还没必要着急去上重仓。
目前在我心里，当下几个板块的优先级排序如下：
1、当下重点做机器人和计算机，已经进入加速上攻阶段，距离阶段性顶部位置越来越近了，要及时做好减仓止盈操作。
2、电网设备趋势延续的不错，可以适当加仓；卫星、军工和有色金属已经顺利突破压力位，可以再观察一两天，如果趋势能得到延续，这两个板块可以成为重点加仓对象。
3、游戏再等等，等突破压力位再说。
4、光伏近期可以重点关注，关注能否突破压力位。
5、电力最近也可以重点关注一下，趋势走的不错。
6、最后，近期我们发现硬件普遍表现要更好一些，位置也普遍都高得离谱了，但是这一波行情下，软件并没有怎么涨，软件近期可以重点关注一下，是否会有迎来科技内部补涨的机会，AI应用这一波风没太刮起来。
我个人今天A股这边做了小幅的调仓操作，适当加仓了一些电网设备、大盘和机器人，激进账户仓位从8成提高回到9成，稳健账户只是提高到8.5成，子弹主要还是给卫星、军工、有色金属这些板块留的，后续一旦确认右侧趋势稳了，我会进一步加仓。
最后，宣传一下我的VIP会员群，每个交易日都有午评分析，操作实时分享，以及VIP专属定制化持仓优化服务，还有基本面、技术面、消息面知识分享教学，有想加入VIP群的朋友，可以后台发送VIP了解一下。
文章的最后，需要再做一个免责声明：上面所有的分析内容也只是我的个人推测，不代表事实一定如此，也不见得一定对，仅供参考，不构成投资建议，投资有风险，入市需谨慎。
点个“在看”支持一下呗～"
2026-05-06,5月开门红！后续调仓思路！,http://mp.weixin.qq.com/s?__biz=Mzk0NDAxODE3NQ==&mid=2247504946&idx=1&sn=5b37d4350ea5608e9ed0beb294c58227&chksm=c32993a2f45e1ab4905efac6aaaeae68d23a56fad752562f4a3dfffbf95f437b5797ec915909#rd,,"点击蓝字
关注我们
今天A股节后首日开盘，迎来开门红，成长板块集体迎来爆发，大盘都涨了1个多点，而成长板块涨幅普遍都达到了三四个点，今天市场赚钱效应很强。
五一期间外盘表现很不错，尤其是美股科技股中的存储方向，昨晚美股的美光科技、闪迪、英特尔等都涨幅超过11个点，超威半导体也表现不错，纳斯达克昨晚这个行情走出来，今天A股半导体的爆发基本上板上钉钉了。
只不过确实没想到今天选择以如此剧烈的方式开启行情，不少板块跳空高开，一点没有回补缺口，同时还继续暴力拉升，科创50盘中最高涨幅接近9个点，今天市场走的有点过度疯狂了，这同样也透支了未来，下午就迎来了大幅跳水，大幅冲高回落，留下一根长长的上影线。
我节前因为担心假期出点什么幺蛾子，清仓止盈了半导体和人工智能两个板块，腾出来2成的仓位过节，这也导致我今天踏空了今天半导体和人工智能的行情。
不过我倒是也没啥后悔的，从倒视镜来看节前的止盈操作导致半导体和人工智能卖飞了一些，但是我依旧认为，节前是无法预知五一假期是否会出什么幺蛾子，我选择了小幅减仓手里留了2成的子弹过节，是一个比较稳妥的选择。
不错因为目前还有约8成的持仓，集中在计算机、机器人、卫星、有色金属、电网设备和游戏这几个板块上，好在今天这几个板块也都比较争气，表现都比较优秀，今天账户整体的收益还是不错，还是能大幅跑赢大盘，收益同创业板相当。
今天这个市场行情走的多少有点疯狂和不理性，而且今天下午大幅的跳水，导致不少板块出现了长长的上影线，这一点非常值得警惕，落到口袋里的才是收益，跟着暴涨暴跌坐过山车就意义不大了，今年的市场收益显然没有去年那么好做，去年降息预期是非常明确的，今年降息与否都还不太好说。
所以，当下依旧还需要盯紧目前持仓中的这几个板块后续止盈的节奏，8成的仓位还在持有中呢，这部分仓位还多没有完全落袋为安呢，还需要把握好后续的止盈节奏和调仓节奏才行。
首先，计算机今天的表现其实一点都不逊色于半导体，盘中最多的时候涨幅也超过了6个点，午后跳水相比半导体也少得多，最终收涨4.8%，半导体这个位置向上还是有一定的空间，我选择了继续持有。
但是，我们需要关注的一件事是，后续计算机是否会接过接力棒，成为上涨主线方向，还是说只是跟涨跟跌，再进一步决定后续是继续持有还是卖出止盈。
机器人这个方向相对而言，涨幅就小了不少，虽然说目前位置上来说，性价比依旧不错，但是目前机器人始终没有走出独立行情，没能区别于其他科技方向走出爆发行情来，这一点是我非常期待能够看到的，因为其他的几个科技方向短期来看都已经明显涨多了，也已经距离见顶越来越近了，唯独计算机和机器人距离前一轮的顶部位置还有不小的距离，还有不小的上涨空间，如果能形成接力，那么这个位置依旧还有不小的布局性价比。
目前个人已经止盈卖掉了人工智能和半导体两个板块，还在持有计算机和机器人两个板块，期待这两个板块能接过接力棒，迎来补涨行情。
除了科技以外，其他的几个方向今天表现也都不错，卫星也大涨3.59%；有色金属大涨3.86%且显然有色金属的行情比较独立；电网设备大涨4个多点，午后也基本上没怎么跳水。
首先，在我看来，卫星这个位置这个趋势，大行情显然都还没有启动，趋势的角度来看，位置也不算高，依旧是完全可以继续持有的。
卫星的行情跟科技板块的行情相对独立一些，走势跟科技并不重合，如果后续科技板块普遍涨得过多，面临见顶回调风险，那么卫星、商用航天这种板块可能会成为接力的大方向。
有色金属也是一样，这一波行情基本上也尚未启动，依旧处于启动的初期，未来上涨潜力依旧比较巨大，且行情也相对比较独立，不太受到科技方向表现的影响，也并没有出现短期涨多了的情况，依旧具备不错的布局性价比。
电网设备板块也是类似的情况，不存在短期涨多了的情况，算是稳步上涨的阶段，也处于趋势形成的初期阶段，依旧还是有不错的布局性价比的。
总结而言，我个人认为，目前CPO、半导体、人工智能都短期普遍涨多了，今天又出现跳空高开后的冲高回落，收了一根长长的上影线，不是好的现象，需要注意阶段性见顶的风险。
计算机和机器人也属于科技细分的板块，虽然说当下位置依旧性价比不错，也没有达到阶段性高点，但是我们需要重点关注，如果一旦其他几个科技板块回调，计算机和机器人能否形成接力，还是受到影响跟着一起跌，根据表现决定是否止盈，个人认为目前还可以再观察看看。
卫星、有色、电网设备，这几个板块目前都还只能算是趋势刚形成的阶段，这几个板块也都没有出现短期涨多了的情况，依旧还是不错的布局性价比，这几个板块可能会成为我后续进一步加仓的几个板块。
当然，以上观点仅代表个人看法，我会按照这个思路去操作，不见得一定对，分享出来仅供大家参考。
最后，传媒游戏依旧有点不温不火，当下市场的热度还在科技这一边，资金都在科技里面抱团，那么其他方向分出来的关注度就比较低，当下卫星、有色和电网设备还能受到一些资金的青睐，涨幅也都不错，起码趋势延续还不错，传媒游戏则属于更低一级别关注度的板块了，估计起码得等到科技方向内部的所有戏份板块轮涨一遍并开始回调以后，才能轮到传媒游戏了。
游戏暂时不会成为我进一步加仓的板块，下一步个人计划：
1、重点关注计算机、机器人的止盈节奏。
2、观察卫星、有色金属、电网设备的趋势延续性如何，并把我好加仓时机。
至于美股，我应该会保持当下半仓持有，短期来看美股纳斯达克也已经有点涨太多了，但是毕竟他是美股，美股即便涨多了也有可能继续涨，但是我希望是稳定的缓慢上涨，这样才符合美股的涨法，最近美股多少有点涨得太快了，也需要稳一稳了，先保持半仓持有吧。
文章的最后，需要再做一个免责声明：上面所有的分析内容也只是我的个人推测，不代表事实一定如此，也不见得一定对，仅供参考，不构成投资建议，投资有风险，入市需谨慎。
点个“在看”支持一下呗～"
2026-04-30,差不多了...... 清仓了AI和半导体！,http://mp.weixin.qq.com/s?__biz=Mzk0NDAxODE3NQ==&mid=2247504931&idx=1&sn=46d4cb3e61be23b998963ab3f7c29186&chksm=c32993b3f45e1aa5573b6ece22529267358286962c45ab6d446ad78746422f92532afd118366#rd,,"点击蓝字
关注我们
这次被删文以后竟然没有被禁言，还挺让我意外的，目前还能发文。
今天半导体和科创50迎来大爆发，大幅拉升并创下新高，原本之前我还一直纠结于半导体始终没有创下新高就卖出止盈了是否不太合适，今天这么一波剧烈拉升，直接科创50和半导体都创下新高了，并且也基本上达到了顶部位置。
五一假期前，我选择清仓止盈了人工智能、半导体和科创50了，这也是我节前A股这边做的仅有的操作。
下面是人工智能、半导体和科创50近期的走势，大家可以看看，即便不说今天就是阶段性最高点了，起码这个位置也应该明显是顶部区域了吧，就看大家想要博多么极限了，我就不贪多选择卖出止盈了。
接下来就是五一小长假了，五天不开盘，安心休息休息陪陪家人吧，五一回来以后看人工智能和半导体表演了，我要看看到底是次次都一样，暴力拉升加速上攻吸引散户进场后就是见顶信号；还是说这一次真的不一样吧。
其他的几个板块我都在继续持有，我前面的文章也说过了，有色金属和游戏，回踩支撑后都顺利守住了，暂时脱离危险，
但是同时二者向上也依旧面临着压力位的挑战还不是很稳妥，可以考虑中性偏低仓位参与，先不重仓，投个不超过10%的仓位比较合适。
另外，我昨天也说了，卫星、军工也跟有色金属前段时间一样，回踩支撑，今天支撑位上方顺利反弹，得到了有效支撑。
同样，这几个板块也都向上有压力位需要挑战，都是比较适合一个中性偏低的仓位，先不着急重仓，等突破压力位以后再去重仓会更稳妥一些。
总结而言，我主要持仓的几个板块，今天把人工智能、半导体和科创50给清仓了。
同时，其他的几个板块都还在继续持有，其中机器人和计算机的仓位比较重，卫星、军工、有色金属、游戏、电网设备，都属于中性及中性偏低的仓位。
美股方面，我今天把美股账户的仓位降低到了半仓，这两天也分批止盈了一些，包括场外的广发全球精选，我发现他不知道投了什么东西，最近跟美股的表现也出现了很大幅度的偏离，我把广发全球精选也给减仓止盈了一半。
五一假期前就这几个操作，剩下的等五一回来再说吧，看点是：
1、CPO显然已经见顶，五一假期回来以后，最近接力爆发的人工智能和半导体、科创50是否也会跟随迎来见顶行情？
2、科技内部是否还会接着出现轮动，机器人和计算机是否会成为轮动接力的那个板块？
3、卫星、有色这些板块，在4月份科技板块普遍涨多了的情况下，5月份能否对压力位形成突破，并迎来爆发行情，从科技手里接过接力棒？
以上是我对于五一假期回来后，市场的期待，5月份一边做一边调整吧。
最后的最后，祝大家五一假期快乐，五一前市场也算是给大家发了一个小红包，今天我看账户表现还是相当不错的，也跑赢大盘挺多，4月份肯定是盈利不错的，安心过假期吧，5月一起再战！
文章的最后，需要再做一个免责声明：上面所有的分析内容也只是我的个人推测，不代表事实一定如此，也不见得一定对，仅供参考，不构成投资建议，投资有风险，入市需谨慎。
点个“在看”支持一下呗～"
