Date,Title,Link,Codes,Content
2026-04-07,最后期限？升级还是taco？,http://mp.weixin.qq.com/s?__biz=Mzk0NDAxODE3NQ==&mid=2247504662&idx=1&sn=278e782d9e6e0dcdf6d3d60c5c7be616&chksm=c3299486f45e1d902fd5f736f47e5d887e417c0d108bd3df40b512b822018da8075e9b3e7770#rd,,"点击蓝字
关注我们
上周五加上今天这两天是A股开盘但港股不开盘，因此这两天A股的表现就是纯内资，没有北向资金参与的情况。因此今天的行情没有太大的参考价值，明天港股恢复交易以后再看看市场的表现再说吧。
周五大盘1个点的下跌破坏了原本还不错的趋势，今天再来一个小幅弱势反弹，内资也确实不给力，稍微转好的一些趋势没有守住，再次被破坏掉了。
A股当下现状有一点尴尬，3月24日至今展现出来一定的韧性，尽管外部环境依旧不好，时紧时松的，但是A股这段时间确实也没有再进一步下跌了，形成了一个阶段性的小底。
但是大家也能看得出来，当下的这个阶段性的小底其实也并不牢靠，更别说右侧趋势了，底部构筑的都还不够扎实，右侧趋势显然更无法形成了。
我其实很早就反复在文章视频里提醒大家，当下战争冲突始终没有得到妥善解决，并且原油价格始终是高居不下，那么这个位置稳妥起见还是不应该给太重的仓位，可以考虑保持半仓或以下的仓位一边观望一边等右侧。
大盘的形态其实相对来说还可以，通过沪深300来看就更加明显了，目前来看是底部形态也不够扎实，MACD也始终没能形成金叉，量能也始终还是在缩量，也没能形成温和放量，量能方面其实也并不是很好。
从近期对A股的观察综合来看吧，当下只能说有震荡筑底的机会和可能性，但是没有到形成右侧趋势，还没到值得上重仓的情况，恐怕大家还得继续保持耐心等一等。
另外，美伊战争冲突现在也明显陷入了僵局，打吧其实也没什么进展，不动点真格的都不知道美国能这么掉链子，先是4月3日那天被打下来两个战机，其中还有一个F15E战机被伊朗用肩扛式导弹打下来，两名战机机组成员还掉落在伊朗境内，为了救两个飞行员，美军接连排除两架救援直升机被伊朗一路追着打。
就这特朗普还整天大吹特吹，无论怎样每天都是赢麻了，特朗普这人简直可怕。
特朗普威胁称4月7日20点是达成停火协议的最后期限，否则伊朗整个国家或一夜之间被彻底击溃，还威胁说要让地狱降临伊朗。
这不今天就是最后期间了嘛，咱们拭目以待看看特朗普后续到底会如何吧，伊朗妥协是基本上不太可能的了，协议没那么容易达成，毕竟协议涉及双方的利益让步了，就不太可能那么容易就达成，那么我们看看特朗普这一次到底是会让战争进一步升级，还是再一次taco吧。
总觉得特朗普这人打嘴炮多过实际，一旦特朗普真的让战争升级，如果真的达到预期效果还好说，否则真的是丢了大面子了，伊朗反正光脚的不怕你穿鞋的，但是美军属于不容有失，否则军事强国的人设就彻底崩了。到时候就别说特朗普中期选举能否保住的问题了，美国的霸权地位都有可能受到威胁。
这一次很有可能依旧还是特朗普的一个极限施压的手段，目的还是以这种极限施压的方式，来恐吓伊朗接受谈判并做出让步，但是特朗普这种欺软怕硬的手段，只适合放在欧洲、日韩等那种国家，显然遇到稍微强硬一些的，例如关税战时遇到中国，例如这一次遇到伊朗，就显然不太好使，只能被迫反复taco，这就是特朗普惯用的伎俩，典型的欺软怕硬。
从目前的情况来看，我个人认为战争恐怕确实没那么容易那么快结束，边打边谈，而谈判显然也没有那么容易达成，已经被拖入持久战了。
那么我们只能等待市场对战争脱敏，对战争双方反反复复放的狠话没那么敏感了，再酌情寻找机会，做一做波段行情了。
从3月底到4月初这段时间，市场明显对战争的敏感程度相比3月中上旬那时下降了很多，市场虽然依旧涨涨跌跌没有太好的表现，但是起码不像之前那样每天都是跌跌不休，一点反弹没有，还经常是迎来大跌，现在起码是进入到震荡模式了，这就是好的开始。
后续只要战争冲突没有再进一步大幅升级，市场还是有机会逐步稳定下来，那时候我们再去寻找机会。
但是当下，我个人还是倾向于，先别急，当下也不是急的时候，再观察一段时间，最好能明确市场的底部已经形成再去寻找机会会更加稳妥，否则你刚费劲找到一个机会，冲进去了，特朗普一句话战局一变有可能前面的逻辑发生了翻天覆地的变化，直接又被套了个大的。
我个人当下是保持一个半仓观望的状态，大家如果觉得有道理，也可保持这样一个进可攻退可守的仓位，再多观察一段时间，等底部确认再去进一步加仓，那样会稳妥很多。
起码从目前原油的价格来看，持续如此高位，油价没有明显回调的话，市场应该好不到哪里去，阶段性的反弹恐怕也难有持续性，高油价和美元指数对于其他市场确确实实是存在不小的压制效果。
文章的最后，需要再做一个免责声明：上面所有的分析内容也只是我的个人推测，不代表事实一定如此，也不见得一定对，仅供参考，不构成投资建议，投资有风险，入市需谨慎。
点个“在看”支持一下呗～"
2026-04-02,全球市场涨跌，全看特一张嘴......,http://mp.weixin.qq.com/s?__biz=Mzk0NDAxODE3NQ==&mid=2247504654&idx=1&sn=f2c35df5a08001827a97eb163c98e1d3&chksm=c329949ef45e1d884f265efa44fa1900b0d7120bb4a2235abbea14a61a2c4b84dd46147f179b#rd,,"点击蓝字
关注我们
当下这个市场真就是不讲任何逻辑，全凭特朗普一张嘴的市场，真是公然操控全球市场并趁机疯狂为自己敛财，然而其他人气的牙痒痒，但是还拿他没有办法，真是绝了。
原本无论是美股还是A股或者黄金，近期都明显逐步稳定下来，昨晚美股也继续顺利反弹1一个多点。
然而，今天早上特朗普特意赶在咱们A股开盘前，9点的时候发表了全国公开讲话，自己宣称对伊朗战事又赢麻了，并且扬言未来两到三周内，将对伊朗进行极其猛烈的打击，暗示战争要进一步升级。
特朗普公开讲话后，原油价格飙升，美元价格飙升，其他市场全部直线跳水，
黄金直线大幅跳水，纽约黄金盘中最多跌超4个点，日经今天也跌了2个多点，韩国股市今天跌了4.5个点。
A股也是无法幸免，今天几乎所有板块集体收绿，大盘靠着尾盘拉升勉强将跌幅控制在1个点以内，而且盘中差一点就跌破了支撑，最终勉强收回到支撑上方，今天算是勉强守住了。
板块层面来看，几乎所有的成长风格板块今天盘中都出现了大幅下跌，几乎属于无差别攻击，没什么逻辑，特朗普一句话的事。
有色金属、黄金、游戏这几个板块都是刚好回踩到支撑，看明天表现吧。
银行表现正常，体现了避险板块属性，算是今天少有的红的板块，趋势也延续的还行。
科技就普遍比较惨了，我之前的文章视频就反复提到了，科技目前的趋势本身就是相对弱，反弹相对比较落后的，底部都没有那么明确，一旦突发事件爆发，往往也是跌的更惨的那一个，基本上表现也在预期范围内，本身就没反弹多少，就是又跌回去了。
就例如这两天评论区里不少人问的机器人要不要加，从当下这个表现来看，我是会倾向于建议不用着急，再等一等也无妨，等底部信号更强烈，最好是能突破了年线再去加都完全来得及。
像CPO、人工智能、半导体、计算机等，就更加不用着急了，都还没有表现出多好的趋势来，都不建议着急上仓位。
而卫星军工现在恐怕也得跟科技坐一桌了，也是趋势并不好，底部信号也不够强烈，完全没有着急上仓位的必要，多看少动为好。
光伏和电力更不用多说了，一直看空。
煤炭和红利今天虽然小幅反弹，但是也只是避险情绪造成的短暂效果，依旧不敢大趋势。细分化工、电网设备也都那样，基本上没有表现太好的板块。
在我看来，近期大盘、有色、黄金、游戏、恒生医疗已经算是少有的几个趋势还算可以的板块了，其他的只能说趋势更差。
目前除了恒生医疗近期确实是足够强势，今天这个行情都没跌下去还能小红，但是短期也涨多了，这个位置进可能也需要成为短期阶段性回踩的风险，因此我也没再着急去加。
我个人的观点和看法是，当下其实很多板块都已经回调到了一个性价比非常高的位置，无论是有色、黄金，还是科技的细分板块，亦或者是商用航天卫星等，都已经经历了连续的回调过后，跌到了一个性价比特别高的位置。
当然，还有大盘，大盘其实也回调到了一个性价比很高的位置。
但是现在的市场并不是缺性价比高的好板块，而是缺乏一个稳定的市场环境，说白了现在就是神一天鬼一天，全看特朗普一张嘴的一个乱世，哪有什么投资逻辑可言了，一个人一句话就可以操纵一切的时期，投资没有什么稳定性可言。
很多板块已经处于相对的低位，性价比确实很高，但是我真的建议大家也积极管住自己的手，并保持克制，别着急乱加，我们现在需要保持克制，保持一个相对较低的仓位，或者是半仓的中性仓位，去耐心的等一个相对稳定的投资环境，否则真的指不定你仓位刚上去，市场也确实反弹的很好，但是随时因为某人的一句话，就给彻底打断并走向另一个极端。
我个人当下是选择暂时将个人的仓位控制在半仓的水平再继续观望一下，不出现比较明确的右侧趋势，我应该会保持克制，尽量不急于去加仓，尤其是科技、卫星等这些方向，底部都没走出来，加仓那么急也只是放大账户的波动，怎么着都得等，还不如账户波动小一点地等。
另外，我个人近期观察来看，当下相较于原油价格的影响来说，似乎美元指数涨跌的影响，对于黄金、美股和A股来说更加直接一些。
美元前两天持续下跌，市场迎来了不错的反弹，今天美元又迎来暴力反弹，全球市场都不好受，黄金也跌，美股股指期货也跌幅不小。
估计今晚美股要迎来阶段性回踩了，我目前美股账户还没有着急出手加仓，我在等，我希望等一个纳斯达克回踩年线确认，如果回踩年线确认跌不破，我再出手加仓，如果跌破了，那就恐怕不能着急还得继续耐心等。
文章的最后，需要再做一个免责声明：上面所有的分析内容也只是我的个人推测，不代表事实一定如此，也不见得一定对，仅供参考，不构成投资建议，投资有风险，入市需谨慎。
点个“在看”支持一下呗～"
2026-04-01,4月开门红！集体反弹！,http://mp.weixin.qq.com/s?__biz=Mzk0NDAxODE3NQ==&mid=2247504638&idx=1&sn=7988b9b9aaaecd9a7811c70590c145b7&chksm=c329956ef45e1c78b59846c08c18e7f402b705d7266826153231d35834929b26a3a3933ff36a#rd,,"点击蓝字
关注我们
从昨晚的美股和黄金再到今天的A股，市场似乎变得有点不太一样了，进入3月以来因为美伊战争原因市场可以说是跌跌不休，已经蛮久没有遇到如此酣畅淋漓的大涨行情了，4月份算是开了一个好头。
首先，昨晚美股反弹幅度蛮大的，主要是因为伊朗总统公开宣称，愿在获得保障的情况下结束战争，伊朗无意挑起战争，但愿意在确保不再遭受攻击的情况下结束战争。
这一消息导致原油大幅跳水，美元指数大跌，黄金大幅拉升，美股股指期货大幅拉升。
近期持续观察下来我发现，伊朗内部现在明显分为两派，一派是以总统、外长为首的这种温和派，还是希望在得到保障的情况下尽快结束战争；
而另一派则是以最高领袖和革命卫队为首的强硬派，态度强硬就是要给以色列和美国报复。
可能确实是因为短期连续下跌跌太多了，市场也确实渴望反弹，同时市场对双方频繁的拉扯，但是没有实质性的进一步升级冲突的情况出现，而开始脱敏了。
其实，昨晚伊朗方面同时出现两种极端的声音，一边是总统表达的希望得到保障的情况下结束战争的声音；另一边是革命卫队表示将对任何暗杀行动采取报复，目标锁定与美国有关联的公司，声明建议员工离开这些工作场所，并呼吁周边1公里范围内的居民转移到安全的区域。
但是昨晚市场显然对第一个消息更感冒，美股持续拉升，大幅收涨，纳斯达克收涨3.83%，重新拉升回到年线上方。
标普500都涨了接近3%，也重新拉回到了年线上方，但是一天的拉升还不敢说一定稳妥了，后面重点关注年线位置能不能稳得住就行了，如果不再重新跌破年线，重新站稳年线，那么就意味着美股后续的反弹就稳了。
美股也确实是持续跌了蛮久了，都来到4月份了，希望这一次的拉升会是一次反攻的开始吧。
美股昨晚日次大幅度的拉升，今天亚盘表现就都差不到哪里去了。尤其是日经和韩国股市，都迎来了暴力反弹，而且近期观察韩国股市，真是暴涨暴跌，比A股还夸张多了，动不动就熔断，占跌都是七八个点起步，确实蛮离谱的，日经则相对正常一些，但是最近也都经常四五个点的涨跌波动。
今天A股虽然看似反弹了一些也不错，但是相较于其他国家股市反弹的表现来看，还是要偏弱一些，比预想的要弱不少，当然确实有几个板块反弹比较强势，且走出了较为明确的右侧趋势。
从我的观察来看，首先，大盘的反弹有点要走出右侧趋势的意思，虽然目前还没有那么强势，但是缓慢震荡反弹的走势逐渐显现出来了，可以考虑适当布局，大盘总归还是相对比较稳的。
如果担心板块暴涨暴跌不好把握，可以考虑投一些大盘，我的稳健账户近期分批买了一些大盘，周一暴跌那天买入了10%仓位，今天又加仓了5%的仓位，仓位给到了15%。
就像昨天文章里面说的那样，我个人观察来看，目前反倒是黄金、有色、传媒、游戏、恒生医疗这几个板块更快地走出了右侧趋势，科技今天虽然反弹也不错，但是相对来说趋势没那么强，卫星和军工也值得重点关注，但是卫星和军工今天的走势并不好，因此暂时没必要动，继续关注即可。
根据近期的观察，以及市场今天的表现，我个人今天盘中是小加了一点有色和游戏，
希望能做一个右侧趋势的尝试。
游戏这个位置连续跌了比较久，并出现了震荡筑底，MACD金叉，伴随小幅放量，是有机会走出右侧趋势的。
之前持仓中还留有部分游戏的仓位，今天进一步加仓，场内激进一些加仓到10%的中性仓位，场外则更加求稳加仓到5%。
有色也是类似，也是小幅加仓了一些。
另外，黄金近期也是可以考虑加仓的对象，黄金也逐渐企稳并走出了右侧趋势。
另外，恒生医疗我原本昨天发文就说了，我是打算加仓了的，因为观察到恒生医疗确实也形成了震荡筑底的走势，是很有机会走出右侧趋势来的，只是今天突然的爆发，这个涨幅，确实我就不好出手了，我打算再等一两天回踩回踩再说。
而且如果能站稳年线再加，做一个大的趋势，应该反倒还更加稳妥。
但是恒生科技目前看来，趋势还是相对比较弱，这个底部构建的也没有那么扎实呢，加仓的优先级反倒是没有那么高。
包括科技和卫星我今天其实也都暂时没有加仓考虑，也是因为这两个方向的板块，目前都还还没有走出明确的右侧趋势，相较于前面提到的黄金、有色、传媒、游戏、恒生医疗趋势还是要弱不少，优先级相对来说没那么高。
至于像细分化工、电力、煤炭、红利、光伏等，就像我昨天文章视频里说的一样，这几个板块当下依旧处于相对的高位，依旧有不小的回调空间，且这几个板块顶部结构都相对比较明确（细分化工再观察观察，其他的顶部结构明确），这些板块确实尽量先避开为好。
昨天有人留言问电网设备，其实电网设备的趋势我看还算可以，只是位置确实是高，但是趋势倒是还算可以，起码还没破位，但是我个人认为当下位置，如果真的机会来了，电网设备可能并不应该作为首选，电网设备上一波炒了蛮久，涨的也很高了，有不少性价比高很多的板块值得入手，而不是再去高位投这么一个可能存在破位风险的板块，起码不应该作为优先的选择在我看来。
总结而言：
当下我个人认为右侧趋势走的更好的方向包括：
大盘、黄金、有色、传媒、游戏、恒生医疗、创新药、银行。
目前走的还可以，但仍需进一步观察的方向包括：科技的几个细分板块、卫星军工、恒生科技、电网设备。
趋势不好，见顶信号明显，且属于下跌中继的方向包括：电力、煤炭、红利、光伏、化工。
仓位上，个人主要加仓的方向是这几个认为走出右侧趋势的，场外则更求稳加的大盘和少量板块，场内激进则直接加的有色、游戏等，目前总仓位来到了进可攻退可守的50%仓位。
我综合考虑了一下，现在右侧趋势刚形成，也是短期利好刺激的，不见得多么稳妥，先提高到半仓这个进可攻退可守的仓位，再边走边看如何进一步调整仓位。
文章的最后，需要再做一个免责声明：上面所有的分析内容也只是我的个人推测，不代表事实一定如此，也不见得一定对，仅供参考，不构成投资建议，投资有风险，入市需谨慎。
点个“在看”支持一下呗～"
2026-03-31,哪些板块看好？哪些建议避开？,http://mp.weixin.qq.com/s?__biz=Mzk0NDAxODE3NQ==&mid=2247504621&idx=1&sn=2a6ed693ad554dd11f74e3d25cf452b7&chksm=c329957df45e1c6bfbcf973c74b22bd518b36788453bb5851dc4b28597b8d7625180b311999a#rd,,"点击蓝字
关注我们
今天A股这市场走的让人挺无奈的，周五和周一两天，一大堆利空，外围市场几乎全部大跌，几乎所有投资者都认为又得砸盘的时候，A股却一反常态地很坚挺，不仅没跌还反弹了一些。
然而，当今天早上出现一个小利好，原油出现大幅跳水，A50等盘前都拉升了不少，当投资者都认为A股已经筑底即将开启反弹激动不已的时候，A股却来了一个超级大跳水，从涨的不错到最后反倒跌了不少。
A股最近这些走势确实是太反人性了，或者甚至可以说是确实有点刻意了，我估计里面是有量化的作用在，给人一种就是要刻意反着来，精准拿捏散户，让大家摸不清头脑的意思。
我个人是强烈建议大家，不要总是掉进他们的节奏里，也不要总是一次一次自己跳进那些别人为你设计好的陷阱里，行情本身就是走出来的，没有那么明确的右侧信号出现，也是急躁不得的。
昨天晚上的文章视频我也提到了我的观点，从目前当下这个市场趋势和节奏来看，可以说最近有震荡筑底的可能性，但是得出反弹稳了，要走右侧了的结论还是为时尚早，不妨再让子弹飞一飞，再观望一下再说。
大盘只要能在年线上方横住，不再像之前那样连续大跌，那么板块上就可以适当找一找机会，当然前期是得确认大盘能稳得住。
当下毕竟是战争冲突依旧在发生，霍尔木兹海峡也并没有恢复开放，当下市场还是危机四伏的状态，那么我就依旧还是保持之前的观点，做右侧比做左侧要稳得多，也建议大家等右侧机会，而不是在左侧就贸然上仓位去做。
板块方面：
目前来看几个科技的细分方向普遍趋势都还不太好，别说右侧趋势了，就连阶段性见底信号都不是那么明确，更像是下跌中继，科技肯定不应该作为近期加仓的首选方向。
黄金和有色近期相对来说机会要更好一些，黄金和有色大家可以重点关注一下机会。黄金和有色的反弹趋势显然要更好一些，更有机会延续右侧上涨趋势。
因此黄金和有色，是我近期重点关注的，随时准备加仓的方向之一。
卫星和军工肯定也是近期值得关注的方向，一方面是这两天有利好出现，另一方面也是因为确实连续阴跌了很多以后，出现了震荡企稳的信号，可以重点关注一下，但是优先级没有黄金和有色高，还得再进一步看一看再说。
同一类型的，传媒游戏近期也可以关注着看看，有初步的筑底形态和反弹趋势，但是还达不到右侧的标准，也得再进一步多看两天。
另外，我今天场内账户小幅加仓了5%仓位的银行，从之前的30%仓位，提高到了35%仓位，一来银行近期的趋势延续的还算不错，而且银行近期的底磨的蛮久的，三轮回踩后形成的一个底部。
银行这个底后续应该不是那么容易跌破的了，银行这个位置很有可能见底并开启一轮新的反弹势头，算是先小幅建仓尝试一下。
然后，我想说近期有几个板块和方向可能需要尽量避开，起码不应该成为优先投资的方向：
1、电力，非常明确的双顶结构，电力的一轮炒作应该结束了，已经顶部信号比较明显，没必要着急去接飞刀，得等跌透。
2、煤炭，见顶信号也是越来越明确了。
3、红利，由于电力和煤炭都存在着见顶回调的风险，那么红利短期也不是好的选择。
4、光伏，位置还相对比较高，且刚形成破位下跌，光伏短期也不能着急接飞刀。
5、细分化工，得看看这个位置会不会成为下跌中继，反弹到压力位无法突破，继而进一步向下去找年线支撑。
最后，恒生医疗我昨天文章视频也有提到，恒生医疗近期可以重点关注一下，但是不着急上车或者加仓，可以稍微再等一等，看一看年线这个重要压力位能否突破得了，再去决定后续的加仓节奏。
恒生科技就不用多说了，完全没有见底的意思，暂不要作为优先的加仓考虑。
总结而言，今天小买了一点银行，场内买了5%仓位做一下尝试，场外账户没动。
近期板块方面可以重点关注有色、黄金、恒生医疗，可以适当关注卫星、军工、传媒游戏。
尽量避开电力、煤炭、红利、光伏、化工、恒生科技等。
科技的几个板块普遍不温不火，趋势一般，不应作为近期加仓首选。
文章的最后，需要再做一个免责声明：上面所有的分析内容也只是我的个人推测，不代表事实一定如此，也不见得一定对，仅供参考，不构成投资建议，投资有风险，入市需谨慎。
点个“在看”支持一下呗～"
