Date,Title,Link,Codes,Content
2026-01-06,继续大涨！牛市旗手爆发......,http://mp.weixin.qq.com/s?__biz=Mzk0NDAxODE3NQ==&mid=2247503920&idx=1&sn=49844621bd1b73b4ccb3eb5ff56d5ec8&chksm=c32997a0f45e1eb6105d2d592f94cdbb378fa9a6bbf0a76f28766bc49d07cdd08dc229ff179d#rd,,"点击蓝字
关注我们
今天大盘真是太猛了，已经13连阳创造了十几年的历史，今天更是拉出了1.5%的大阳线，大有要开始加速上攻的意思，这个趋势走的真是太强势了。
而且大家也看到了，我之前的文章视频里反复强调过最为看重的便是量能，一个上涨行情量能是否能持续温和放量，是行情延续的关键。
最近市场已经出现了持续放量的情况，今天又一次放量2650亿，交易量来到了2.8万亿，最近量能相较之前明显回暖，这也是我节前敢加满的重要原因之一。
今天其实最让人惊喜的板块是券商，放巨量大涨4个多点，一根大阳线拔地而起。
还记得我昨晚的文章视频里是怎么评价券商的吗？非常简短的一句话，趋势已经走出来了，静待爆发吧，确实也没想到第二天就迎来大爆发了。
券商这一波我是12月19日就开始建议布局埋伏的，当时给出的理由是，年线上方稳住了，两次挑战压力位，再次回踩时候不破年线就可以开始分批布局了，说明底部已经走出来了，爆发只是早晚的事了。
我个人带着粉丝埋伏了10%的仓位，这种板块我也不建议多投，10%仓位就挺好，不多也不少，什么时候爆发等着就行了，心态也比较稳，如果重仓可能反倒有些朋友拿不住了。
挺好，券商明天可以继续看看行情能否有延续性，虽然券商行情通常比较短，但是也不至于只一天行情，后面还有机会，依旧可以再拿一拿。
另外，今天持仓中表现比较好的依旧是科技方向，计算机、半导体都是大涨2个多点，科创50涨幅也接近2个点，表现依旧强势。
大家也知道，我最开始着重布局的三个方向分别是机器人、计算机和恒生科技，机器人率先见底并走出强势反弹行情，后面就是计算机也迎来强势反弹，最后是恒生科技，元旦后底才走出来并开启反弹行情。
计算机我也已经推荐了蛮久的时间了，12月25日的时候我在文章视频里就已经明确说计算机底部走出来了，当时机器人已经爆发两次了，计算机我也说了后续有机会迎来补涨行情，当下可以加仓了，是一个加仓的最佳时机，我自己也加了不少，后续的走势大家也都看到了，也是一路强势反弹，最近两天涨了5.5个点，量能也是持续温和放量。
半导体就不多说了，这趋势延续的太好了，量能也跟得上，半导体也说了半个多月了，现在回过头去看，当时说的时候也确实是最佳入场时机，现在真的涨起来了，很多人还不敢加了，当时加刚好加在了一个阶段性小低点。
科创50跟半导体的趋势差不多，也是明显形成突破了，最近的文章视频也反复说了，也不多赘述了。
机器人今天没能跟上市场节奏，但是这个趋势大家不用太担心，这趋势依旧延续的很好，且虽然底部开始猛拉了三根大阳线，但是中期维度来看位置依旧不高，依旧是可以继续持有的，行情从来也都不是一天涨出来的，也不是一天就定胜负的，好的板块耐心拿住就行了，得对他有信心。
最后，恒生科技也没啥可说的，这个底部也明显走出来了，假期暴力拉升一天，涨了4个点，昨天迎来盘整，几乎没涨没跌，今天又小幅拉升接近1.5个点，这个走势还是蛮健康的，拉太快了反倒不好，得让5日均线能慢慢追上来，这样趋势走的才够稳。
恒生科技我也是相当看好的，我也是之前年线位置的时候，坚定看好并建议大家分批布局的，我自己也投了很多嘛，已经有不错的盈利了。
这一波行情，别的板块我可能关注不多，我不多评价，但是我个人认为，我目前正在投的这三大方向，布局的位置都非常不错，都是底部区域，并且近期即便有所反弹，基本上也都只是刚起步，并不算高点。
我主投的几个方向，我最近的文章视频里面也基本上每天都给大家展示了，非常直观和明显，并且我这么一个求稳的人，都在节前满仓了，就足以说明我的看好程度了，我是一个轻易不满仓的人，除非我认为机会非常好，安全性也相对有保障。
而节前12月中旬的时候，就出现了这样的机会，所以我才会大胆猛加仓并上了重仓，并频繁发文发视频表达我的看好，并建议大家分批布局，大家可以回过头去看我12月份发的文章。
经常看我文章的朋友是否还记得，态度的转折点其实就在连续三大潜在利空相继落地的那一周。
当时失业率数据高于市场预期，CPI通胀数据爆冷大幅下降，日本加息幅度符合市场预期，我当时就说三个潜在利空相继落地，两个成了利好一个利空落地，后续没有什么潜在的利空了，当下就是最佳的布局时机。
不知道大家还有印象吗？
当下大家再去看，确实那时候就是最好的进场位置，近期都涨的很不错了。
但是话又说回来，即便我选的这些板块近期确实也都涨得很好，但是他们现在就已经高了吗？其实也依旧不高。
例如恒生科技，这一轮最高点6700多点一路跌下来，持续阴跌了3个月，回调到5350点附近，跟我当初给的点位几乎一点不差，就是年线位置，然后这才反弹到了5800多点，这个位置高吗？
再例如机器人，过去多轮行情，就是踏着年线震荡上行，前面一轮也是调整了3个月的时间，一路下跌，如今才反弹半个月1950点的位置，很高吗？
再例如计算机，大家自己看自己评价嘛。
从大趋势判断的角度来看，我个人认为这些板块虽然短期反弹了不少，但是位置依旧不高，向上空间依旧是不小的。
当然，如果你只是看一两天的短线，问我明天还能不能涨，那我真没法告诉你答案，我也不是神仙，我判断不了，谁也不敢说能猜准明天的涨跌，短期的行情预测基本上就是瞎蒙。
但是站在为期一两个月的中期视角来看，这个位置我个人认为依旧很低，我应该会继续持有，即便我们心里也清楚不可能每天都涨，也有可能会有回踩，但是我依旧认为只会是回踩，而非一波行情的终结。
我还挺看好这一轮的春节行情能有一波大波段行情的，可以适当多拿一拿。
最后的最后，很多人关心创新药，问的人挺多，我的观点是，创新药这个位置突然反弹，底部其实并不牢固，不像前面的几个板块，底部走磨了好久，底部走的很稳了以后才迎来爆发。创新药这个底还有一点点脆弱，刚好反弹也即将来到压力位，是检验反弹成色的时候，接下来两天可以重点关注一下，如果能对60日均线形成突破，可以适当加仓了，或者如果压力位没有突破，二次回踩前低可以考虑分批建仓，创新药我是觉得反倒没必要那么急躁，这个底够不够牢靠可以再多看看。
最后，宣传一下我的VIP会员群，每个交易日都有午评分析，操作实时分享，以及VIP专属定制化持仓优化服务，有想加入VIP群的朋友，可以后台发送VIP了解一下。
文章的最后，需要再做一个免责声明：上面所有的分析内容也只是我的个人推测，不代表事实一定如此，也不见得一定对，仅供参考，不构成投资建议，投资有风险，入市需谨慎。
点个“在看”支持一下呗～"
2026-01-05,开门首日大涨！！！,http://mp.weixin.qq.com/s?__biz=Mzk0NDAxODE3NQ==&mid=2247503901&idx=1&sn=a9f1bc48408d3e471f3bb84922e3787f&chksm=c329978df45e1e9bda8081f0b92646d894e108c73dd31dce1882d1eb6f91f266ae673e4d394a#rd,,"点击蓝字
关注我们
今天A股是2026年第一个交易日，迎来了开门红，今天大盘都大涨了1.38%，重新站上了4000点。账户更是大涨3.35%，跑赢大盘2个点，今年算是开了个好头。
我节前的文章视频里不止一次的提及，我认为新一轮的波段行情已经启动，年底前很有可能站上4000点。
元旦假期前，其实仅有一步之遥了，但是不知道假期前两天为何突然熄火，连续两天近乎没涨也没跌，为2025年留下一丝遗憾。
但是相比我预测的仅晚了一个交易日，2026年首日便迎来重大突破，并重新站上4000点，给今年开了一个好头。
我12月份的文章视频里，已经反复推荐了三大方向，并且我也早已重仓了这三大方向，并且我这一波行情的持股集中度可以说是相当高。
最近三大方向的底部均已走出，且其中两个趋势已经走的相当优秀，今天也助我单日大涨3.35%，跑赢大盘接近2个点。
这三个方向我近期已反复提及，一个是机器人，一个是科技大类下的那几个板块，另一个是港股互联网。
机器人作为我的第一大重仓，最近的表现相当强势，节前就已经完成了年线上方构筑双底，快速拉升并顺利突破了60日均线压力，趋势非常好。
节后首日更是顶着前两日传出的小利空，依旧大涨接近2个点，现在机器人的趋势走的可以说相当强势，并且当下依旧位置不高，向上空间依旧不小。
我的第二大重仓是科技大类的几个板块，场内我重仓了科创50，今日大涨4.4%，前面震荡盘整了一个多月，今天一举完成突破，也算是一个标志性的转折点，科创50后续依旧还有不错的上涨空间。
跟科创50接近的，我场外投了10%仓位的半导体，今天也是放量大涨4.44%，节前我已经多次讲过了，半导体已经形成突破，很大概率要开启新一轮行情了。我的半导体这一轮建仓也才半个月。
场外的另一个接近20%仓位重仓的计算机我也是已经说了好久了，节前我也明确说了，计算机年线上方的底已经彻底走稳了，可以趁着低点布局了，机器人已经先涨了，计算机很有可能后面会迎来补涨，今天计算机也迎来大爆发，大涨了3.44%，这也是我场外账户的第二大重仓，主要是计算机当下的位置依旧挺低，向上空间依旧巨大。
持仓中还有7.5%仓位的人工智能，今天也涨了3.62%，表现也很不错。
这几个科技类的，大趋势来看大体一致，我个人场内重仓的是科创50，占场内的接近30%仓位，仅次于机器人。
场外我则投的相对分散，接近20%的计算机，10%的半导体和7.5%的人工智能。加起来37%，比机器人的22%还要高出15%仓位。
我的最后一个重仓是恒生科技，场内接近25%的仓位，场外我投那只由于限购我小幅分批买的比较慢，投了15%的仓位，也不算低。
虽然今天恒生科技表现一般，但是假期A股不开盘，恒生科技已经先涨过了，并且大涨了4个点，今天场内ETF迎来补涨，场外今天也会把假期大涨那天和今天的收益合并更新。
恒生科技我个人也是一点都不担心，年线上方这个底部已经算是走出来了，一波大涨过后，来到了60日均线压力位置，今天盘整盘整也非常正常，行情从来不可能是一两天就能快速走出来的，后续大的趋势是很看好的，震荡上行反倒更加良性，让更多人都有机会参与并赚到钱。
上面那三大重仓，结合近期市场整体的趋势，以及几个板块的趋势来看，这三个是我近期最看好的方向。
很显然，市场如果想要有一个好的表现，这些板块势必会比大盘表现更好，这些板块是带动市场节奏的板块，大盘跌的时候这些板块自然也会跌，但是一旦市场转好，这些板块都能很快修复，比其他的边角料板块持有体验肯定会更好。
有些边角料板块，你明显感受得到，大盘涨的时候勉强跟上节奏，或者甚至跟不上市场节奏，大盘跌的时候，这些板块也一点不抗跌，甚至跌的更狠，这种板块就一定不要参与了。
说白了，还是要挑市场资金热捧的主线方向去做，不要总是试图在边角料板块上去捞金。
当然，我的持仓还有一个其他的板块，例如券商、创新药和中药，仓位相对小一些，今天表现也都不错。
券商这个趋势也已经走出来了，静待爆发吧。
今天创新药虽然大涨，我个人也持有一些仓位的创新药，我也希望他能有持续的行情，但是创新药当下的这个底走的还有点脆弱，还得在观察观察，底部从来都不是一天就能走出来的，也不会那么快从ICU就瞬间抬进了KTV，也需要一定的时间去震荡筑底，放平心态再观察观察吧。
今天市场整体表现不错，但是从今天各个板块的涨幅对比，以及同大盘涨幅的对比，大家也能看出来哪些板块是带节奏的强势板块，而哪些板块是被市场情绪带起来的跟随板块。
大家需要做的是，找到带动市场节奏的主线方向，去弱留强，主线适当多投，支线只是跟随市场的板块少投甚至不投。
因为市场大盘不会一直这么好，一旦市场表现一般的时候，主线方向可能不跌、少跌或者甚至小涨，而这些跟随的板块很有可能比大盘跌的还多，近期行情不错，大家可以趁机做一做持仓结构的调整，优化一下自己的持仓。
最后，宣传一下我的VIP会员群，每个交易日都有午评分析，操作实时分享，以及VIP专属定制化持仓优化服务，有想加入VIP群的朋友，可以后台发送VIP了解一下。
文章的最后，需要再做一个免责声明：上面所有的分析内容也只是我的个人推测，不代表事实一定如此，也不见得一定对，仅供参考，不构成投资建议，投资有风险，入市需谨慎。
点个“在看”支持一下呗～"
2026-01-02,恒科大涨4个点！！！,http://mp.weixin.qq.com/s?__biz=Mzk0NDAxODE3NQ==&mid=2247503885&idx=1&sn=3c30fb3d08f9024cb216d18feea5e292&chksm=c329979df45e1e8b6c9f325222df44d3059f6e6dac7a91dee25b272c6989be34282bed3d86b3#rd,,"点击蓝字
关注我们
今天是元旦假期的第二天，A股继续休市，但是港股已经恢复交易，今天恒生科技开盘给大家带来了一个新年大礼。
恒生科技今天单日大涨4个多点，一根大阳线直接宣布年线的底彻底站稳了，今天这根大阳线走出来，我就放心多了。
最近的文章视频我已经反复说过了，我目前A股这边仓位最重的板块是机器人，最近已经率先在年线上方形成双底并顺利突破反转了。
第二重仓便是科技的几个方向，场内重仓了科创50，场外则是计算机、半导体、人工智能分散投的，科技方向合计的持仓占比也很高。
第三大重仓便是恒生科技，恒生科技场内账户持有接近25%的仓位，仓位占比也很高；场外求稳一些，分批加仓到了15%的仓位，对于场外账户稳健风格来说也算是很重的仓位了。
之前只是觉得恒生科技位置足够低了，回踩到年线强支撑也始终稳在年线上方没有彻底跌破，倾向于认为恒生科技这里就是底部区域了，但是因为恒生科技始终也是踩在年线上方，没有强反弹脱离危险区域，所以始终还是有那么一点担忧。
但是今天这4个点的大涨行情走出来，算是把恒生科技的底彻底走稳了，恒生科技后续行情可以更乐观了，恒生科技这一波我也基本上在年线附近分批布局完成了，耐心持仓待涨就行了。
虽然说近期太多人质疑恒生科技，太多人唾弃了，但是我始终认为，恒生科技虽然波动比较大，但是大的趋势依旧是震荡上行的，回踩到年线就是一个极佳的布局时机，同时严重脱离年线太远的距离也是一个需要及时减仓止盈的时机。
恒生科技我个人认为底部已经走出来了，后续行情可以适当乐观一些了，但是当然这也不意味着恒生科技从此刻就可以一飞冲天，每天都涨，震荡上行依旧会是主旋律，所以想要赚到不错的收益，保持耐心持有，买的位置好固然重要，拿得住也很重要。
今天恒生科技暴力拉升4个点，截至目前为止，我最近强烈看好，重仓去做的三大方向，底部都已经走出来了，机器人也已经突破走出右侧趋势，科技也在稳步上涨，恒生科技虽有落后，但也依旧坚定看好。
这我就长舒一口气了，看好的方向都走出来了，后续就是坚定持有，耐心等一轮大行情，起码做成一波中期大波段吧。
最后，宣传一下我的VIP会员群，有想加入VIP群的朋友，可以后台回复VIP了解。
文章的最后，需要再做一个免责声明：上面所有的分析内容也只是我的个人推测，不代表事实一定如此，也不见得一定对，仅供参考，不构成投资建议，投资有风险，入市需谨慎。
点个“在看”支持一下呗～"
2025-12-31,元旦假期快乐！！！,http://mp.weixin.qq.com/s?__biz=Mzk0NDAxODE3NQ==&mid=2247503875&idx=1&sn=a9a9e41b426fc83017d222c9103f38c8&chksm=c3299793f45e1e8579e4505d03c5f6abe4870d1606b2bcfc81fd757c60959dee9c1b1e73dbd1#rd,,"点击蓝字
关注我们
今天A股大盘表现还算可以，最终小幅收涨，节前最后一个交易日微涨0.09%，又收了一根小阳线，但是今天科技等方向表现一般。
今天除了商业航天卫星相关的方向以外，其他方向表现都比较一般。
机器人小跌0.54%，半导体、科创50、人工智能、恒生科技等也都是小跌1个来点，前面连续涨了好几天了，今天小幅回调一些也正常。
目前回调也还算是良性回调，也没有跌破趋势，只是觉得有点惊讶，前面几天拉大盘都拉得挺好的，都已经逼近4000点了，距离4000点只差不到1个点的剧烈，结果节前最后这两天，某队竟然只是保了一个横盘微微张，并没有挑战4000点的意思，最终收在3968.84点，挺可惜的。
今天元旦假期前最后一天，一会还要陪一陪家人跨年，今天就不多写了，回调也并不多，还算是良性回调，那就：
一来祝愿大家元旦快乐，好好休息休息，好好陪一陪家人；
二来忙碌了一整年，今年A股市场整体表现其实还算不错，取得的收益也大体还算满意，虽然最后一个季度表现不是很好略有遗憾，但是一年下来也差强人意。
大家好好休息，元旦假期后，希望还能陪着大家并肩作战，为2026年全新一年的收益努力，希望大家都能在新的一年赚的更多。
最后，感谢大家一年以来对我的支持与信任，我希望自己新的一年不忘初心，能输出更多优质的内容，能对更多人有所帮助。
感恩2025，也祝愿大家包括我自己2026年的投资一切顺利
文章的最后，需要再做一个免责声明：上面所有的分析内容也只是我的个人推测，不代表事实一定如此，也不见得一定对，仅供参考，不构成投资建议，投资有风险，入市需谨慎。
点个“在看”支持一下呗～"
